[{"affects_buy_score":false,"canonical_id":"banana","crop_code":"A1","crop_name_raw":"香蕉","dataset_semantics":"traceability_market_event","eligible_for_market_aggregate":false,"event_id":"h44:3d3ffee3bda93cb4911aae06d67e5adc26a7e943af50c33ce942c53eb5483594","market_code":"104","market_name":"台北二","record_type":"traceability_market_event","retrieved_at":"fixture","schema_version":"1.0","semantic_warning":"H44 是獨立的產銷履歷／有機農產品市場交易事件；溯源代號不等於 7556 履歷碼，且事件不納入行情彙總或 Buy Score。","source_id":"moa_traceability_market_h44","source_role":"authoritative_market_event","source_status":"fixture","source_url":"https://data.moa.gov.tw/open_detail.aspx?id=H44","traceability_class_code":"X","transaction_amount_twd":42800,"transaction_date":"2026-09-06","transaction_volume_kg":1600},{"affects_buy_score":false,"canonical_id":"cucumber","crop_code":"FC1","crop_name_raw":"胡瓜","dataset_semantics":"traceability_market_event","eligible_for_market_aggregate":false,"event_id":"h44:b64bc0a9a3c9d86bd00d18b82a43ae06affd6d17f05e0fd47811a45da68db8ef","market_code":"260","market_name":"宜蘭市","record_type":"traceability_market_event","retrieved_at":"fixture","schema_version":"1.0","semantic_warning":"H44 是獨立的產銷履歷／有機農產品市場交易事件；溯源代號不等於 7556 履歷碼，且事件不納入行情彙總或 Buy Score。","source_id":"moa_traceability_market_h44","source_role":"authoritative_market_event","source_status":"fixture","source_url":"https://data.moa.gov.tw/open_detail.aspx?id=H44","traceability_class_code":"X","transaction_amount_twd":17800,"transaction_date":"2026-09-06","transaction_volume_kg":640},{"affects_buy_score":false,"canonical_id":"dragon-fruit","crop_code":"811","crop_name_raw":"紅龍果","dataset_semantics":"traceability_market_event","eligible_for_market_aggregate":false,"event_id":"h44:e9905b12acc179ef2757b411dcebc0bef17dc4e4de4757f32dd6d71c8b6c785c","market_code":"220","market_name":"板橋區","record_type":"traceability_market_event","retrieved_at":"fixture","schema_version":"1.0","semantic_warning":"H44 是獨立的產銷履歷／有機農產品市場交易事件；溯源代號不等於 7556 履歷碼，且事件不納入行情彙總或 Buy Score。","source_id":"moa_traceability_market_h44","source_role":"authoritative_market_event","source_status":"fixture","source_url":"https://data.moa.gov.tw/open_detail.aspx?id=H44","traceability_class_code":"4","transaction_amount_twd":28650,"transaction_date":"2026-09-06","transaction_volume_kg":900},{"affects_buy_score":false,"canonical_id":"pineapple","crop_code":"B2","crop_name_raw":"鳳梨","dataset_semantics":"traceability_market_event","eligible_for_market_aggregate":false,"event_id":"h44:c7d420eaac5eea90f4677ccc052b2c488b771d3022960c1081d4a093013c6dd9","market_code":"109","market_name":"台北一","record_type":"traceability_market_event","retrieved_at":"fixture","schema_version":"1.0","semantic_warning":"H44 是獨立的產銷履歷／有機農產品市場交易事件；溯源代號不等於 7556 履歷碼，且事件不納入行情彙總或 Buy Score。","source_id":"moa_traceability_market_h44","source_role":"authoritative_market_event","source_status":"fixture","source_url":"https://data.moa.gov.tw/open_detail.aspx?id=H44","traceability_class_code":"7","transaction_amount_twd":31500,"transaction_date":"2026-09-06","transaction_volume_kg":1400},{"affects_buy_score":false,"canonical_id":"water-spinach","crop_code":"LF1","crop_name_raw":"蕹菜","dataset_semantics":"traceability_market_event","eligible_for_market_aggregate":false,"event_id":"h44:c56fb8f6fea7969b88323102348947a27c5f0a997277d458912a0e585ec72a2e","market_code":"800","market_name":"高雄市","record_type":"traceability_market_event","retrieved_at":"fixture","schema_version":"1.0","semantic_warning":"H44 是獨立的產銷履歷／有機農產品市場交易事件；溯源代號不等於 7556 履歷碼，且事件不納入行情彙總或 Buy Score。","source_id":"moa_traceability_market_h44","source_role":"authoritative_market_event","source_status":"fixture","source_url":"https://data.moa.gov.tw/open_detail.aspx?id=H44","traceability_class_code":"7","transaction_amount_twd":22400,"transaction_date":"2026-09-06","transaction_volume_kg":720}]