[{"affects_buy_score":false,"canonical_id":"banana","crop_code":"A1","crop_name_raw":"香蕉","dataset_semantics":"traceability_market_event","eligible_for_market_aggregate":false,"event_id":"h44:9feb2d36636e2908c944ecac9b89b6b8998dfeee36f49b39f216223494a3ab59","market_code":"104","market_name":"台北二","record_type":"traceability_market_event","retrieved_at":"fixture","schema_version":"1.0","semantic_warning":"H44 是獨立的產銷履歷／有機農產品市場交易事件；溯源代號不等於 7556 履歷碼，且事件不納入行情彙總或 Buy Score。","source_id":"moa_traceability_market_h44","source_role":"authoritative_market_event","source_status":"fixture","source_url":"https://data.moa.gov.tw/open_detail.aspx?id=H44","traceability_class_code":"X","transaction_amount_twd":42800,"transaction_date":"2026-10-18","transaction_volume_kg":1600},{"affects_buy_score":false,"canonical_id":"cucumber","crop_code":"FC1","crop_name_raw":"胡瓜","dataset_semantics":"traceability_market_event","eligible_for_market_aggregate":false,"event_id":"h44:76b270c72da214be7b5159f097a7695b936d4295cbb23c10cad042ea5e24bbfb","market_code":"260","market_name":"宜蘭市","record_type":"traceability_market_event","retrieved_at":"fixture","schema_version":"1.0","semantic_warning":"H44 是獨立的產銷履歷／有機農產品市場交易事件；溯源代號不等於 7556 履歷碼，且事件不納入行情彙總或 Buy Score。","source_id":"moa_traceability_market_h44","source_role":"authoritative_market_event","source_status":"fixture","source_url":"https://data.moa.gov.tw/open_detail.aspx?id=H44","traceability_class_code":"X","transaction_amount_twd":17800,"transaction_date":"2026-10-18","transaction_volume_kg":640},{"affects_buy_score":false,"canonical_id":"dragon-fruit","crop_code":"811","crop_name_raw":"紅龍果","dataset_semantics":"traceability_market_event","eligible_for_market_aggregate":false,"event_id":"h44:e20be44eb1c568a2af5ae510be52566784477cb0ec58e317cdb2cfdbb859b2cf","market_code":"220","market_name":"板橋區","record_type":"traceability_market_event","retrieved_at":"fixture","schema_version":"1.0","semantic_warning":"H44 是獨立的產銷履歷／有機農產品市場交易事件；溯源代號不等於 7556 履歷碼，且事件不納入行情彙總或 Buy Score。","source_id":"moa_traceability_market_h44","source_role":"authoritative_market_event","source_status":"fixture","source_url":"https://data.moa.gov.tw/open_detail.aspx?id=H44","traceability_class_code":"4","transaction_amount_twd":28650,"transaction_date":"2026-10-18","transaction_volume_kg":900},{"affects_buy_score":false,"canonical_id":"pineapple","crop_code":"B2","crop_name_raw":"鳳梨","dataset_semantics":"traceability_market_event","eligible_for_market_aggregate":false,"event_id":"h44:8a9e649d1b6469c5b1049bff8ab98338426c7bc77f1ea08676500b43323cbdad","market_code":"109","market_name":"台北一","record_type":"traceability_market_event","retrieved_at":"fixture","schema_version":"1.0","semantic_warning":"H44 是獨立的產銷履歷／有機農產品市場交易事件；溯源代號不等於 7556 履歷碼，且事件不納入行情彙總或 Buy Score。","source_id":"moa_traceability_market_h44","source_role":"authoritative_market_event","source_status":"fixture","source_url":"https://data.moa.gov.tw/open_detail.aspx?id=H44","traceability_class_code":"7","transaction_amount_twd":31500,"transaction_date":"2026-10-18","transaction_volume_kg":1400},{"affects_buy_score":false,"canonical_id":"water-spinach","crop_code":"LF1","crop_name_raw":"蕹菜","dataset_semantics":"traceability_market_event","eligible_for_market_aggregate":false,"event_id":"h44:09a68880e6470714c490d84da63fd84cb157470a8ae2371b957f746ede7fde2c","market_code":"800","market_name":"高雄市","record_type":"traceability_market_event","retrieved_at":"fixture","schema_version":"1.0","semantic_warning":"H44 是獨立的產銷履歷／有機農產品市場交易事件；溯源代號不等於 7556 履歷碼，且事件不納入行情彙總或 Buy Score。","source_id":"moa_traceability_market_h44","source_role":"authoritative_market_event","source_status":"fixture","source_url":"https://data.moa.gov.tw/open_detail.aspx?id=H44","traceability_class_code":"7","transaction_amount_twd":22400,"transaction_date":"2026-10-18","transaction_volume_kg":720}]