[{"affects_buy_score":false,"canonical_id":"banana","crop_code":"A1","crop_name_raw":"香蕉","dataset_semantics":"traceability_market_event","eligible_for_market_aggregate":false,"event_id":"h44:6c3f11f0482a6d49bdcb0e1a61b14e56a8f2c6972ab8a18672e3a8b6719170f9","market_code":"104","market_name":"台北二","record_type":"traceability_market_event","retrieved_at":"fixture","schema_version":"1.0","semantic_warning":"H44 是獨立的產銷履歷／有機農產品市場交易事件；溯源代號不等於 7556 履歷碼，且事件不納入行情彙總或 Buy Score。","source_id":"moa_traceability_market_h44","source_role":"authoritative_market_event","source_status":"fixture","source_url":"https://data.moa.gov.tw/open_detail.aspx?id=H44","traceability_class_code":"X","transaction_amount_twd":42800,"transaction_date":"2026-08-31","transaction_volume_kg":1600},{"affects_buy_score":false,"canonical_id":"cucumber","crop_code":"FC1","crop_name_raw":"胡瓜","dataset_semantics":"traceability_market_event","eligible_for_market_aggregate":false,"event_id":"h44:6da97c700525e889028daa63302cc0f4c5278e8c886031dbe921a9191a69f42c","market_code":"260","market_name":"宜蘭市","record_type":"traceability_market_event","retrieved_at":"fixture","schema_version":"1.0","semantic_warning":"H44 是獨立的產銷履歷／有機農產品市場交易事件；溯源代號不等於 7556 履歷碼，且事件不納入行情彙總或 Buy Score。","source_id":"moa_traceability_market_h44","source_role":"authoritative_market_event","source_status":"fixture","source_url":"https://data.moa.gov.tw/open_detail.aspx?id=H44","traceability_class_code":"X","transaction_amount_twd":17800,"transaction_date":"2026-08-31","transaction_volume_kg":640},{"affects_buy_score":false,"canonical_id":"dragon-fruit","crop_code":"811","crop_name_raw":"紅龍果","dataset_semantics":"traceability_market_event","eligible_for_market_aggregate":false,"event_id":"h44:109e7392860862fbadfb3bbfad7d13f80d0c4727c8f11fc861e0cfb430fcaed2","market_code":"220","market_name":"板橋區","record_type":"traceability_market_event","retrieved_at":"fixture","schema_version":"1.0","semantic_warning":"H44 是獨立的產銷履歷／有機農產品市場交易事件；溯源代號不等於 7556 履歷碼，且事件不納入行情彙總或 Buy Score。","source_id":"moa_traceability_market_h44","source_role":"authoritative_market_event","source_status":"fixture","source_url":"https://data.moa.gov.tw/open_detail.aspx?id=H44","traceability_class_code":"4","transaction_amount_twd":28650,"transaction_date":"2026-08-31","transaction_volume_kg":900},{"affects_buy_score":false,"canonical_id":"pineapple","crop_code":"B2","crop_name_raw":"鳳梨","dataset_semantics":"traceability_market_event","eligible_for_market_aggregate":false,"event_id":"h44:4cd2f1976f369976946eae13ef22b15c826047b66c0463a952dddc15da1428cf","market_code":"109","market_name":"台北一","record_type":"traceability_market_event","retrieved_at":"fixture","schema_version":"1.0","semantic_warning":"H44 是獨立的產銷履歷／有機農產品市場交易事件；溯源代號不等於 7556 履歷碼，且事件不納入行情彙總或 Buy Score。","source_id":"moa_traceability_market_h44","source_role":"authoritative_market_event","source_status":"fixture","source_url":"https://data.moa.gov.tw/open_detail.aspx?id=H44","traceability_class_code":"7","transaction_amount_twd":31500,"transaction_date":"2026-08-31","transaction_volume_kg":1400},{"affects_buy_score":false,"canonical_id":"water-spinach","crop_code":"LF1","crop_name_raw":"蕹菜","dataset_semantics":"traceability_market_event","eligible_for_market_aggregate":false,"event_id":"h44:559078444a94f9b9f6e955705721ce1c285d833fbcdcc6fc6a60943e5da8a7cd","market_code":"800","market_name":"高雄市","record_type":"traceability_market_event","retrieved_at":"fixture","schema_version":"1.0","semantic_warning":"H44 是獨立的產銷履歷／有機農產品市場交易事件；溯源代號不等於 7556 履歷碼，且事件不納入行情彙總或 Buy Score。","source_id":"moa_traceability_market_h44","source_role":"authoritative_market_event","source_status":"fixture","source_url":"https://data.moa.gov.tw/open_detail.aspx?id=H44","traceability_class_code":"7","transaction_amount_twd":22400,"transaction_date":"2026-08-31","transaction_volume_kg":720}]