[{"affects_buy_score":false,"canonical_id":"banana","crop_code":"A1","crop_name_raw":"香蕉","dataset_semantics":"traceability_market_event","eligible_for_market_aggregate":false,"event_id":"h44:3d1c7a7ea581d394a6fed94cc9b8a1038beabb5ae24908c37425902f53c35dc1","market_code":"104","market_name":"台北二","record_type":"traceability_market_event","retrieved_at":"fixture","schema_version":"1.0","semantic_warning":"H44 是獨立的產銷履歷／有機農產品市場交易事件；溯源代號不等於 7556 履歷碼，且事件不納入行情彙總或 Buy Score。","source_id":"moa_traceability_market_h44","source_role":"authoritative_market_event","source_status":"fixture","source_url":"https://data.moa.gov.tw/open_detail.aspx?id=H44","traceability_class_code":"X","transaction_amount_twd":42800,"transaction_date":"2026-09-16","transaction_volume_kg":1600},{"affects_buy_score":false,"canonical_id":"cucumber","crop_code":"FC1","crop_name_raw":"胡瓜","dataset_semantics":"traceability_market_event","eligible_for_market_aggregate":false,"event_id":"h44:acb01bd66701e5752dcfae3931afe7d73a9485771a6973974a7e8a996e9aa48d","market_code":"260","market_name":"宜蘭市","record_type":"traceability_market_event","retrieved_at":"fixture","schema_version":"1.0","semantic_warning":"H44 是獨立的產銷履歷／有機農產品市場交易事件；溯源代號不等於 7556 履歷碼，且事件不納入行情彙總或 Buy Score。","source_id":"moa_traceability_market_h44","source_role":"authoritative_market_event","source_status":"fixture","source_url":"https://data.moa.gov.tw/open_detail.aspx?id=H44","traceability_class_code":"X","transaction_amount_twd":17800,"transaction_date":"2026-09-16","transaction_volume_kg":640},{"affects_buy_score":false,"canonical_id":"dragon-fruit","crop_code":"811","crop_name_raw":"紅龍果","dataset_semantics":"traceability_market_event","eligible_for_market_aggregate":false,"event_id":"h44:7f3964caa36180df18525bfeaa33ce1c7d4abffdf804d8db5ad934815dc715aa","market_code":"220","market_name":"板橋區","record_type":"traceability_market_event","retrieved_at":"fixture","schema_version":"1.0","semantic_warning":"H44 是獨立的產銷履歷／有機農產品市場交易事件；溯源代號不等於 7556 履歷碼，且事件不納入行情彙總或 Buy Score。","source_id":"moa_traceability_market_h44","source_role":"authoritative_market_event","source_status":"fixture","source_url":"https://data.moa.gov.tw/open_detail.aspx?id=H44","traceability_class_code":"4","transaction_amount_twd":28650,"transaction_date":"2026-09-16","transaction_volume_kg":900},{"affects_buy_score":false,"canonical_id":"pineapple","crop_code":"B2","crop_name_raw":"鳳梨","dataset_semantics":"traceability_market_event","eligible_for_market_aggregate":false,"event_id":"h44:0fe81da8bae919b1284939caf94e2c1b02c71ff554853cf0e70576eb1a7140a4","market_code":"109","market_name":"台北一","record_type":"traceability_market_event","retrieved_at":"fixture","schema_version":"1.0","semantic_warning":"H44 是獨立的產銷履歷／有機農產品市場交易事件；溯源代號不等於 7556 履歷碼，且事件不納入行情彙總或 Buy Score。","source_id":"moa_traceability_market_h44","source_role":"authoritative_market_event","source_status":"fixture","source_url":"https://data.moa.gov.tw/open_detail.aspx?id=H44","traceability_class_code":"7","transaction_amount_twd":31500,"transaction_date":"2026-09-16","transaction_volume_kg":1400},{"affects_buy_score":false,"canonical_id":"water-spinach","crop_code":"LF1","crop_name_raw":"蕹菜","dataset_semantics":"traceability_market_event","eligible_for_market_aggregate":false,"event_id":"h44:c411ae01bf828104185396b221f8508438c995e76c94c990682f6d465ea2b0cb","market_code":"800","market_name":"高雄市","record_type":"traceability_market_event","retrieved_at":"fixture","schema_version":"1.0","semantic_warning":"H44 是獨立的產銷履歷／有機農產品市場交易事件；溯源代號不等於 7556 履歷碼，且事件不納入行情彙總或 Buy Score。","source_id":"moa_traceability_market_h44","source_role":"authoritative_market_event","source_status":"fixture","source_url":"https://data.moa.gov.tw/open_detail.aspx?id=H44","traceability_class_code":"7","transaction_amount_twd":22400,"transaction_date":"2026-09-16","transaction_volume_kg":720}]