[{"affects_buy_score":false,"canonical_id":"banana","crop_code":"A1","crop_name_raw":"香蕉","dataset_semantics":"traceability_market_event","eligible_for_market_aggregate":false,"event_id":"h44:8caf3c1a27d5a4d6e090d717cde348096c89d927bfa2e831ddde507059dba58c","market_code":"104","market_name":"台北二","record_type":"traceability_market_event","retrieved_at":"fixture","schema_version":"1.0","semantic_warning":"H44 是獨立的產銷履歷／有機農產品市場交易事件；溯源代號不等於 7556 履歷碼，且事件不納入行情彙總或 Buy Score。","source_id":"moa_traceability_market_h44","source_role":"authoritative_market_event","source_status":"fixture","source_url":"https://data.moa.gov.tw/open_detail.aspx?id=H44","traceability_class_code":"X","transaction_amount_twd":42800,"transaction_date":"2026-10-28","transaction_volume_kg":1600},{"affects_buy_score":false,"canonical_id":"cucumber","crop_code":"FC1","crop_name_raw":"胡瓜","dataset_semantics":"traceability_market_event","eligible_for_market_aggregate":false,"event_id":"h44:bf800a5d9557da9748ca42ff262f5bb0c1f80be2cfd5a49406d21c051538f77f","market_code":"260","market_name":"宜蘭市","record_type":"traceability_market_event","retrieved_at":"fixture","schema_version":"1.0","semantic_warning":"H44 是獨立的產銷履歷／有機農產品市場交易事件；溯源代號不等於 7556 履歷碼，且事件不納入行情彙總或 Buy Score。","source_id":"moa_traceability_market_h44","source_role":"authoritative_market_event","source_status":"fixture","source_url":"https://data.moa.gov.tw/open_detail.aspx?id=H44","traceability_class_code":"X","transaction_amount_twd":17800,"transaction_date":"2026-10-28","transaction_volume_kg":640},{"affects_buy_score":false,"canonical_id":"dragon-fruit","crop_code":"811","crop_name_raw":"紅龍果","dataset_semantics":"traceability_market_event","eligible_for_market_aggregate":false,"event_id":"h44:0c7aacf699cab038a7acccb7adcfa0da00f6769fab24cd49fa4a5c005f853806","market_code":"220","market_name":"板橋區","record_type":"traceability_market_event","retrieved_at":"fixture","schema_version":"1.0","semantic_warning":"H44 是獨立的產銷履歷／有機農產品市場交易事件；溯源代號不等於 7556 履歷碼，且事件不納入行情彙總或 Buy Score。","source_id":"moa_traceability_market_h44","source_role":"authoritative_market_event","source_status":"fixture","source_url":"https://data.moa.gov.tw/open_detail.aspx?id=H44","traceability_class_code":"4","transaction_amount_twd":28650,"transaction_date":"2026-10-28","transaction_volume_kg":900},{"affects_buy_score":false,"canonical_id":"pineapple","crop_code":"B2","crop_name_raw":"鳳梨","dataset_semantics":"traceability_market_event","eligible_for_market_aggregate":false,"event_id":"h44:2bea9b5795576b79b6ac974405ddf474281efae0ce2d24fa54afc87d2e6543cc","market_code":"109","market_name":"台北一","record_type":"traceability_market_event","retrieved_at":"fixture","schema_version":"1.0","semantic_warning":"H44 是獨立的產銷履歷／有機農產品市場交易事件；溯源代號不等於 7556 履歷碼，且事件不納入行情彙總或 Buy Score。","source_id":"moa_traceability_market_h44","source_role":"authoritative_market_event","source_status":"fixture","source_url":"https://data.moa.gov.tw/open_detail.aspx?id=H44","traceability_class_code":"7","transaction_amount_twd":31500,"transaction_date":"2026-10-28","transaction_volume_kg":1400},{"affects_buy_score":false,"canonical_id":"water-spinach","crop_code":"LF1","crop_name_raw":"蕹菜","dataset_semantics":"traceability_market_event","eligible_for_market_aggregate":false,"event_id":"h44:32c5ade8471b1aace50906c192a3c9817a4a80ad9d615ff9728e0dd4dbe53fa5","market_code":"800","market_name":"高雄市","record_type":"traceability_market_event","retrieved_at":"fixture","schema_version":"1.0","semantic_warning":"H44 是獨立的產銷履歷／有機農產品市場交易事件；溯源代號不等於 7556 履歷碼，且事件不納入行情彙總或 Buy Score。","source_id":"moa_traceability_market_h44","source_role":"authoritative_market_event","source_status":"fixture","source_url":"https://data.moa.gov.tw/open_detail.aspx?id=H44","traceability_class_code":"7","transaction_amount_twd":22400,"transaction_date":"2026-10-28","transaction_volume_kg":720}]